<?xml version="1.0" encoding="ISO-8859-1"?>
<receitas
        xmlns="trabalhoPDE"
        xmlns:xsi="http://www.w3.org/2001/XMLSchema-instance"
        xsi:schemaLocation="trabalhoPDE receitas.xsd">
    <cabecalho>
        <titulo>Sobremesas Italianas</titulo>
        <autor>Breno Fernando Guerra Marrão</autor>
        <data-publicacao>
            2023-10-18
        </data-publicacao>
    </cabecalho>
    <seção>
        <titulo>Sobremesas do sul italiano</titulo>
        <texto-introdutorio>Nesta parte iremos abordar sobremesas que pertencem ao sul italiano</texto-introdutorio>
        <receita>
            <nome>Canoli</nome>
            <calorias>100</calorias>
            <categoria>sobremesa</categoria>
            <dificuldade>simples</dificuldade>
            <tempo>lento</tempo>
            <custo>barato</custo>
            <ilustração>./images/canoli</ilustração>
            <ingredientes>
                <ingrediente id="pistachio" quantidade="1" unidade-medida="chavena">
                    pistachio
                </ingrediente>
                <ingrediente id="sal">
                    sal
                </ingrediente>
                <ingrediente id="açucar" quantidade="4" unidade-medida="colher">
                    açucar
                </ingrediente>
                <ingrediente id="ovos" quantidade="2">
                    ovos
                </ingrediente>
                <ingrediente id="oleo-vegetal">
                    Óleo vegetal
                </ingrediente>
                <ingrediente id="canela" quantidade="1" unidade-medida="colher">
                    canela
                </ingrediente>
                <ingrediente id="vinho-marsala" quantidade="3" unidade-medida="colher">
                    vinho-marsala
                </ingrediente>
                <ingrediente id="farinha-trigo-sem-fermento" quantidade="2" unidade-medida="chavenas">
                    farinha de trigo sem fermento
                </ingrediente>
                <ingrediente id="queijo-creme" quantidade="250" unidade-medida="gramas">
                    quejo creme
                </ingrediente>
                <ingrediente id="ricotta" quantidade="500" unidade-medida="gramas">
                    ricotta
                </ingrediente>
            </ingredientes>
            <instruções>
                <texto-instrução>

                1. Para fazer a massa numa batedeira misture 2 chávenas e meia de <ingredienteRef
                    ref="farinha-trigo-sem-fermento"/> com <ingredienteRef ref="açucar"/>. Adicione 1 <ingredienteRef
                    ref="ovos"/> e 3 c. de <ingredienteRef ref="oleo-vegetal"/>.
                2. Utilize o acessório de massa para bater e, de seguida, adicione 1 c. de <ingredienteRef ref="canela"/> e 3 c. de sopa de <ingredienteRef
                    ref="vinho-marsala"/>. Bata novamente.
                3. Coloque a massa numa superfície coberta com <ingredienteRef ref="farinha-trigo-sem-fermento"/> e trabalhe-a até ficar com uma espessura de cerca de 0,5cm. Corte-a em discos de 10 a 15 cm de diâmetro.
                4. Com a ajuda de um cilindro de cannoli, enrole a massa à sua volta e com 1 clara de <ingredienteRef
                    ref="ovos"/> cole a ponta. Aqueça óleo numa frigideira e coloque os cannolis para fritar. Retire e coloque num prato com papel absorvente.
                5. Recheio: Enquanto arrefecem, numa taça coloque 500g de ricotta, 250g de queijo creme e 4 c. de sopa de açúcar em pó. Misture tudo.
                6. Dentro de um prato coloque <ingredienteRef ref="pistachio"/> grosseiramente picados com uma pitada de <ingredienteRef
                    ref="sal"/>. Num saco de pasteleiro coloque a mistura de <ingredienteRef ref="queijo-creme"/> e recheie o interior dos cannolis. Passe as pontas pelo prato com os<ingredienteRef ref="pistachio"/>.
                7. Polvilhe, no final, com <ingredienteRef ref="açucar"/> em pó.
                    ------ Posso também referenciar outras receitas <receitaRef ref="receita-teste"/>
                </texto-instrução>
            </instruções>
        </receita>
        <receita id="receita-teste">
            <nome>Nova receita de teste</nome>
            <ingredientes>
                <ingrediente id="teste">
                    teste
                </ingrediente>
            </ingredientes>
            <instruções>
                <passo>
                </passo>
            </instruções>
        </receita>

    </seção>
</receitas>