<?xml version="1.0" encoding="ISO-8859-1"?>
<receitas
        xmlns:xsi="http://www.w3.org/2001/XMLSchema-instance"
        xsi:noNamespaceSchemaLocation="receitas.xsd">
    <cabecalho>
        <titulo>Livro de receitas do Breno</titulo>
        <titulo>Validação?</titulo>
        <autor>Breno Fernando Guerra Marrão</autor>
        <autor>Se quiser posso adicionar outros autores</autor>
        <data-publicacao>
            2023-10-18
        </data-publicacao>
        <resumo>
            Esse é o resumo opcional
        </resumo>
    </cabecalho>

    <parte >
        <titulo>Comida italiana</titulo>
        <texto-introdutorio>Esse é o texto-introdutorio opcional</texto-introdutorio>
        <ilustração>uri</ilustração>
        <receita id ="1">
            <nome>
                Spaghetti Bolonhesa
            </nome>
            <ilustração>"./images/spaghetti"</ilustração>
            <dificuldade>simples</dificuldade>
            <categoria>prato-principal</categoria>
            <custo>barato</custo>
            <tempo>medip</tempo>

            <!-- aqui irei adicionar uma receita como exemplo -->
            <ingredientes>
                <ingrediente id="3">
                    <nome>
                        spaghetti
                    </nome>
                    <!-- Opcional -->

                    <quantidade>
                        100
                    </quantidade>
                    <!-- Opcional -->
                    <unidade-medida>
                        gramas
                    </unidade-medida>
                </ingrediente>
                <ingrediente  id ="4">
                    <nome>Molho </nome>
                    <quantidade>100</quantidade>
                    <unidade-medida>ml</unidade-medida>
                </ingrediente>
            </ingredientes>
            <instruções >
                Para fazer o molho
                <passo id="fazer-molho">
                    Aquecer o <ingredienteRef ref="4"/>
                </passo>
                Para fazer a massa
                <passo id="fazer-massa">
                    Cozinhar o <ingredienteRef ref="3"/>
                </passo>
                Para fazer o molho
                <passo id="juntar-massa-molho">
                    Juntar <ingredienteRef ref="3"/> e <ingredienteRef ref="4"/>
                </passo>
            </instruções>
        </receita>
        <seção>
            <!-- ainda posso opcionalmente adicionar uma seção -->
            <titulo>
                Comida de Roma
            </titulo>
            <receita>
                <nome>Spaghetti Alfredo</nome>
                <ingredientes >
                    <ingrediente id="5">
                        <nome>
                            spaghetti
                        </nome>
                        <!-- Opcional -->

                        <quantidade>
                            100
                        </quantidade>
                        <!-- Opcional -->
                        <unidade-medida>
                            gramas
                        </unidade-medida>
                    </ingrediente>
                    <ingrediente  id ="6">
                        <nome>Molho </nome>
                        <quantidade>100</quantidade>
                        <unidade-medida>ml</unidade-medida>
                    </ingrediente>
                </ingredientes>
                <instruções>
                    <passoRef ref="fazer-molho"/>
                    <passoRef ref="fazer-massa"/>
                </instruções>
            </receita>

            <sub-seção>
                <titulo>Sobremesas</titulo>
                <receita id="tiramisu"   >
                    <nome>
                        tiramisu
                    </nome>
                    <tempo>lento</tempo>
                    <custo>barato</custo>
                    <categoria>sobremesa</categoria>
                    <dificuldade>dificil</dificuldade>
                    <ilustração>./images/tiramisu</ilustração>
                    <ingredientes >
                        <ingrediente id="cafe">
                            <nome>cafe</nome>
                            <quantidade>100</quantidade>
                            <unidade-medida>ml</unidade-medida>
                        </ingrediente>
                        <ingrediente id="biscoito">
                            <nome>biscoito champangne</nome>
                            <quantidade>1</quantidade>
                            <unidade-medida>pacotes</unidade-medida>
                        </ingrediente>
                        <ingrediente id="açucar"/>
                        <ingrediente id="leite"/>
                        <ingrediente id="gemas">
                            <nome>gemas</nome>
                            <quantidade>
                                3
                            </quantidade>
                        </ingrediente>
                        <ingrediente id="chocolate em po"/>
                        <ingrediente id="mascarpone">
                            <nome>mascarpone</nome>
                            <quantidade>500</quantidade>
                            <unidade-medida>gramas</unidade-medida>
                        </ingrediente>
                    </ingredientes>
                    <instruções>
                        <passo>
                            Bata o <ingredienteRef ref="leite"/> na batedeira até obter um chantilly firme.
                        </passo>
                        <passo>
                            Reserve
                        </passo>
                        <passo>
                            Bata o <ingredienteRef ref="açucar"/> com as <ingredienteRef ref="gemas"/> e o conhaque por 3 minutos.
                        </passo>
                        <passo>
                            Acrescente o chantilly, o <ingredienteRef ref="mascarpone"/> e misture bem.
                        </passo>
                        <passo>
                            Molhe rapidamente os <ingredienteRef ref="biscoito"/> no <ingredienteRef ref="cafe"/> (um a um) e coloque em um refratário formando uma camada, coloque por cima uma camada do creme, faça mais uma camada de <ingredienteRef ref="biscoito"/> molhados no <ingredienteRef ref="cafe"/> e por último mais uma camada de creme.
                        </passo>
                        <passo>
                            Para finalizar polvilhe <ingredienteRef ref="chocolate em po"/> em pó amargo.
                        </passo>
                        <passo>
                            Leve à geladeira por no mínimo 3 horas e sirva.
                        </passo>

                    </instruções>
                </receita>
            </sub-seção>
        </seção>
    </parte>

</receitas>